{
  "jsonrpc": "2.0",
  "id": "apps-instances-register",
  "method": "hub.apps.registerInstance",
  "params": {
    "password": "sample-password-1",
    "instance": {
      "instanceId": "sample-instance-1",
      "appId": "sample.app",
      "scope": "",
      "pid": 32001,
      "invoke": {
        "poll": true,
        "respond": true
      }
    }
  }
}
